{
  "run_id": "22222222-2222-4222-8222-222222222222",
  "case_id": "11111111-1111-4111-8111-111111111111",
  "plan_id": "55555555-5555-4555-8555-555555555555",
  "plan_version": 1,
  "plan_hash": "dddddddddddddddddddddddddddddddddddddddddddddddddddddddddddddddd",
  "bound_state_hash": "bbbbbbbbbbbbbbbbbbbbbbbbbbbbbbbbbbbbbbbbbbbbbbbbbbbbbbbbbbbbbbbb",
  "workflow_template": {
    "id": "77777777-7777-4777-8777-777777777777",
    "workflow_key": "regulatory-impact-review",
    "version": "1.0.0",
    "manifest_sha256": "6f535115bbfe1cb2e9fe29ee80b3c8b15c4409157829e1ae836fcb3adc36ce67"
  },
  "status": "RUNNING",
  "checkpoint_version": 2,
  "active_step_key": "extract_findings",
  "steps": {
    "extract_findings": {
      "status": "RUNNING",
      "attempt": 1,
      "invocation_id": "88888888-8888-4888-8888-888888888888",
      "approval_id": null,
      "output_sha256": null,
      "usage": {
        "turns": 0,
        "tool_calls": 0,
        "input_tokens": 0,
        "output_tokens": 0,
        "runtime_seconds": 0,
        "cost_usd": 0
      }
    }
  },
  "budget": {
    "turns": 0,
    "tool_calls": 0,
    "input_tokens": 0,
    "output_tokens": 0,
    "runtime_seconds": 0,
    "cost_usd": 0
  }
}
